{
  "project": "python-greeter-to-go",
  "source": {
    "language": "python",
    "path": "source/greeter.py"
  },
  "target": {
    "language": "go",
    "path": "target"
  },
  "rows": [
    {
      "name": "Port greeting function",
      "status": "complete",
      "contract": "Port the Python greet(name) behavior to a Go Hello(name string) function with the same blank-name default and punctuation.",
      "source_refs": [
        "source/greeter.py:greet"
      ],
      "write_scope": [
        "target/greeter.go",
        "target/greeter_test.go"
      ],
      "test_commands": [
        "cd target && go test ./..."
      ],
      "acceptance": [
        "Hello(\"Ada\") returns \"Hello, Ada!\".",
        "Hello(\"\") returns \"Hello, world!\"."
      ],
      "done_signal": [
        "validate-local-example.sh passes without calling Gormes tooling."
      ]
    }
  ]
}
